online,192,,3,10/04/2025 11:36,10/04/2025 11:37,"Score 3The Utility’s senior managementmainly focuses on ensuring the organisation and staff comply with laws and regulations.The senior management communicates to staff about compliance on an ad hoc basis, e.g., when significant issues emerge.There is no evidence of communication on the organisation’s integrity standards with external stakeholders.",Score 4Between 3 and 5,Score 4Between 3 and 5,"Score 3There is a gift policy in place, with clear definitions of the value and type of gift permissible to employees.There is a mechanism for employees only to self-disclose to the organisation any potential or actual conflicts of interest.Conflicts of interest declarations are not required from the board of directors or contractors.","Score 3There is a written whistle-blowing policy. However, it lacks vital elements such as a guaranteed anonymous reporting or incentives for reporting violations.There is evidence that employees were trained on the use of the whistle-blower mechanism, however the training took place more than 3 years ago.",Score 4Between 3 and 5,Score 4Between 3 and 5,Score 4Between 3 and 5,Score 4Between 3 and 5,"Score 5There is an approved annual budget and all expense accounts are regularly reviewed and analysed using comparisons with budgeted amounts.Reconciliation of all accounts is carried out at frequent regular intervals, such as monthly or quarterly. The following accounts are reconciled at minimum: accounts receivable, accounts payable, bank statements, and payroll registers to the general ledger control accounts.The employee payroll list is reviewed periodically for duplicates and ghost employees.The Utility conducts random, unannounced audits of all of the following: inventory, cash, expense, purchasing, billing, and other accounts by internal or external auditors. The Utility implements a non-revenue water reduction programme, which includes all of the following components: water balance analysis, leak detection, repair and maintenance, performance incentives, field audits, commercial audits, maintaining an up-to-date customer database.The Utility has a disconnection policy for non-payment. The disconnection policy takes tailored approaches to various customer segments, and has safeguards to protect vulnerable customers during the debt recovery process.",,,,,,NA,NA,UNKNOWN
online,195,23/04/2025 15:55,6,23/04/2025 15:04,23/04/2025 15:55,Score 5The Utility’s senior management has established a set of ethical values and integrity principles beyond what is required by law and regulations.There is evidence of regular communication by senior management about the organisation’s integrity standards to both staff and external stakeholders.,"Score 5The code of conduct (or a similar document) contains ALL of the elements outlined in Level 3.The code of conduct was revised at most 3 years ago or more recently, after 1) the most recent changes to workplace profiles, including restructuring, relocation, changes in key roles or decision-making processes, or 2) the most recent changes in the external environment, including sector reform, new relevant legislation, changes in government strategies or in contractors’ business practices.Code of conduct training is routinely given to new employees as part of their induction programme.","Score 5The Utility regularly conducts integrity risk assessments. The assessments consider a comprehensive list of integrity risks, which the Utility reviews and updates to incorporate new risks emerging from changes to the workplace profile or changes in the external environment.","Score 5There is a gift policy in place, with clear definitions of the value and type of gift permissible to employees.Conflicts of interest declarations are required from 1) management 2) board members 3) contractors.The Utility maintains a registry of all conflicts of interest declarations.The agenda of the board of director meetings includes a standing item on conflicts of interest declarations, to enable attendees to identify any conflicts of interest relating to the agenda items.","Score 5There is a written whistle-blowing policy, which clearly spells out the protection offered to employees against discrimination, dismissal or other forms of retribution for reporting misconduct and cooperating with an audit or investigation. The policy also guarantees anonymous reporting or provides incentives for reporting violations.An annual training course on the whistle-blowing policy is provided to employees.","Score 5All positions have a clear job description and statement of the minimum competencies. All open positions are advertised publicly.There is an objective and transparent shortlisting and interview process, and also a non-discrimination policy, that facilitate a fair assessment of each applicant irrespective of gender, race, ethnicity, religion and disability.The outcome of the recruitment process for managerial positions is always publicly announced.There is a process for objections relating to recruitment, which is explicitly communicated to job candidates.","Score 5The Utility has established procurement thresholds and procedures for competitive bidding, and they are fully adhered to in all contracts. The Utility conducts due diligence and background checks on all contractors. Organisational policies explicitly prohibit the acceptance of personal gifts or gratuities from bidders and contractors.The Utility sanctions contractors for non-compliance with its integrity rules on procurement. The Utility systematically assesses complaints and whistle-blowing reports regarding procurement irregularities.There is evidence of community monitoring in large procurement projects.All of the following tasks are apportioned between different departments or individuals: procurement requisition, requisition approval, purchase order issuance, receiving (inspecting good or services), payment disbursement.","Score 5The Utility discloses all minimum financial and non-financial information outlined under Level 3. The financial statements are published both in their original format, and also in a summarised form to make them more easily understandable. All information is up-to-date, and available in a searchable format on the organisation's website. There is evidence that the organisation systematically fulfils access to information requests.","Score 5The Utility implements a public participation policy, which requires, as a minimum, direct annual meetings involving each customer group defined by demographic segmentation, including gender, socioeconomic status, geography, ethnicity, and language.The Utility assigns staff responsibilities for recording, reviewing, and responding to stakeholder feedback. There is evidence that outcomes of user participation and feedback are incorporated in decision-making processes.The Utility has a well-functioning complaints mechanism, which assigns staff responsibilities for recording complaints, reporting complaints to the appropriate managers, resolving complaints, responding to users, and monitoring action taken against complaints.","Score 5There is an approved annual budget and all expense accounts are regularly reviewed and analysed using comparisons with budgeted amounts.Reconciliation of all accounts is carried out at frequent regular intervals, such as monthly or quarterly. The following accounts are reconciled at minimum: accounts receivable, accounts payable, bank statements, and payroll registers to the general ledger control accounts.The employee payroll list is reviewed periodically for duplicates and ghost employees.The Utility conducts random, unannounced audits of all of the following: inventory, cash, expense, purchasing, billing, and other accounts by internal or external auditors. The Utility implements a non-revenue water reduction programme, which includes all of the following components: water balance analysis, leak detection, repair and maintenance, performance incentives, field audits, commercial audits, maintaining an up-to-date customer database.The Utility has a disconnection policy for non-payment. The disconnection policy takes tailored approaches to various customer segments, and has safeguards to protect vulnerable customers during the debt recovery process.","Score 5The Utility has a written policy to guide managers and to ensure consistency in disciplinary action against integrity malpractices and misconduct. The policy has been duly shared and communicated to the staff.Roles in relation to investigation of allegations of integrity malpractice perpetrated by staff, disciplinary action, and referral of allegations of corruption to relevant authorities are clearly defined and fully resourced (staff and budget).Records of all allegations of malpractice or corruption, as well as any resulting disciplinary action are held centrally (such as with Human Resources).If a disciplinary action was taken against staff in the past, information about the case and the nature of disciplinary action was communicated to the Utility employees to make them aware of the consequences of corrupt behaviour.","Score 5The Utility has a written and approved sanctions’ policy. The contracts explicitly stipulate a set of sanctionable misconduct and the specific consequences for the misconduct.Roles in relation to investigation of allegations of integrity malpractice perpetrated by contractors, disciplinary action, and referral of allegations of corruption to relevant authorities are clearly defined and fully resourced (staff and budget).Records of sanctions, a black and/or white list of contractors are held centrally and accessibly to conduct background checks on bidders.All sanctioned organisations are required to implement comprehensive corrective measures to enable them to resume their business relationship with the Utility after a cooling off period of ineligibility to undertake work for the Utility.","Score 5The Utility regularly communicates a summary of its integrity standards, integrity risk mitigation measures, and outcomes in an easily accessible public platform, such as on its website and/or in its annual report.There is evidence that internal audit assesses integrity risks related to both activities of non-management staff and corporate governance processes.Internal audit regularly reports on integrity risks to the board of directors.The board of directors regularly monitors the risk of management override and fraud.",Score 5There is a policy to ascertain whether the integrity risk management is functioning effectively.The board of directors regularly (at least annually) provides oversight of integrity risks by reviewing and assessing the Utility’s integrity risk management programme and capacity.An independent auditor assesses the Utility's implementation of the integrity risk management programme on an annual basis.,Score 5The Utility implements an action plan to respond to all findings and recommendations from external audit.The Utility manages to comply fully with standards and directives set by the relevant regulatory body for water and sanitation services.The Utility regularly (at least annually) reports progress on its mandate to expand services to the unserved or underserved areas.,19,50,Latin America and Caribbean
online,196,,2,24/04/2025 05:38,24/04/2025 05:50,Score 5The Utility’s senior management has established a set of ethical values and integrity principles beyond what is required by law and regulations.There is evidence of regular communication by senior management about the organisation’s integrity standards to both staff and external stakeholders.,"Score 5The code of conduct (or a similar document) contains ALL of the elements outlined in Level 3.The code of conduct was revised at most 3 years ago or more recently, after 1) the most recent changes to workplace profiles, including restructuring, relocation, changes in key roles or decision-making processes, or 2) the most recent changes in the external environment, including sector reform, new relevant legislation, changes in government strategies or in contractors’ business practices.Code of conduct training is routinely given to new employees as part of their induction programme.","Score 5The Utility regularly conducts integrity risk assessments. The assessments consider a comprehensive list of integrity risks, which the Utility reviews and updates to incorporate new risks emerging from changes to the workplace profile or changes in the external environment.",,,,,,,,,,,,,NA,NA,UNKNOWN
online,199,,4,09/06/2025 05:08,09/06/2025 05:09,Score 4Between 3 and 5,"Score 3The code of conduct (or a similar document) contains most of the following elements (some elements may be missing): an ethical framework for decision making, generic examples of what constitute acceptable and unacceptable behaviour, guidelines on reporting problems anonymously, accountability and disciplinary policies for unethical behaviour, a list of ethics and compliance resources.The code of conduct was not revised in the last 3 calendar years. There is evidence that the Utility has organised a training on the code of conduct in the past, but the training is not routinely provided.","Score 5The Utility regularly conducts integrity risk assessments. The assessments consider a comprehensive list of integrity risks, which the Utility reviews and updates to incorporate new risks emerging from changes to the workplace profile or changes in the external environment.","Score 5There is a gift policy in place, with clear definitions of the value and type of gift permissible to employees.Conflicts of interest declarations are required from 1) management 2) board members 3) contractors.The Utility maintains a registry of all conflicts of interest declarations.The agenda of the board of director meetings includes a standing item on conflicts of interest declarations, to enable attendees to identify any conflicts of interest relating to the agenda items.","Score 5There is a written whistle-blowing policy, which clearly spells out the protection offered to employees against discrimination, dismissal or other forms of retribution for reporting misconduct and cooperating with an audit or investigation. The policy also guarantees anonymous reporting or provides incentives for reporting violations.An annual training course on the whistle-blowing policy is provided to employees.","Score 5All positions have a clear job description and statement of the minimum competencies. All open positions are advertised publicly.There is an objective and transparent shortlisting and interview process, and also a non-discrimination policy, that facilitate a fair assessment of each applicant irrespective of gender, race, ethnicity, religion and disability.The outcome of the recruitment process for managerial positions is always publicly announced.There is a process for objections relating to recruitment, which is explicitly communicated to job candidates.","Score 5The Utility has established procurement thresholds and procedures for competitive bidding, and they are fully adhered to in all contracts. The Utility conducts due diligence and background checks on all contractors. Organisational policies explicitly prohibit the acceptance of personal gifts or gratuities from bidders and contractors.The Utility sanctions contractors for non-compliance with its integrity rules on procurement. The Utility systematically assesses complaints and whistle-blowing reports regarding procurement irregularities.There is evidence of community monitoring in large procurement projects.All of the following tasks are apportioned between different departments or individuals: procurement requisition, requisition approval, purchase order issuance, receiving (inspecting good or services), payment disbursement.","Score 5The Utility discloses all minimum financial and non-financial information outlined under Level 3. The financial statements are published both in their original format, and also in a summarised form to make them more easily understandable. All information is up-to-date, and available in a searchable format on the organisation's website. There is evidence that the organisation systematically fulfils access to information requests.","Score 5The Utility implements a public participation policy, which requires, as a minimum, direct annual meetings involving each customer group defined by demographic segmentation, including gender, socioeconomic status, geography, ethnicity, and language.The Utility assigns staff responsibilities for recording, reviewing, and responding to stakeholder feedback. There is evidence that outcomes of user participation and feedback are incorporated in decision-making processes.The Utility has a well-functioning complaints mechanism, which assigns staff responsibilities for recording complaints, reporting complaints to the appropriate managers, resolving complaints, responding to users, and monitoring action taken against complaints.",Score 4Between 3 and 5,"Score 5The Utility has a written policy to guide managers and to ensure consistency in disciplinary action against integrity malpractices and misconduct. The policy has been duly shared and communicated to the staff.Roles in relation to investigation of allegations of integrity malpractice perpetrated by staff, disciplinary action, and referral of allegations of corruption to relevant authorities are clearly defined and fully resourced (staff and budget).Records of all allegations of malpractice or corruption, as well as any resulting disciplinary action are held centrally (such as with Human Resources).If a disciplinary action was taken against staff in the past, information about the case and the nature of disciplinary action was communicated to the Utility employees to make them aware of the consequences of corrupt behaviour.","Score 5The Utility has a written and approved sanctions’ policy. The contracts explicitly stipulate a set of sanctionable misconduct and the specific consequences for the misconduct.Roles in relation to investigation of allegations of integrity malpractice perpetrated by contractors, disciplinary action, and referral of allegations of corruption to relevant authorities are clearly defined and fully resourced (staff and budget).Records of sanctions, a black and/or white list of contractors are held centrally and accessibly to conduct background checks on bidders.All sanctioned organisations are required to implement comprehensive corrective measures to enable them to resume their business relationship with the Utility after a cooling off period of ineligibility to undertake work for the Utility.",,,,NA,NA,UNKNOWN
online,200,,0,30/06/2025 17:13,30/06/2025 17:14,,,,,,,,,,,,,,,,NA,NA,UNKNOWN
online,202,,2,17/07/2025 11:12,17/07/2025 11:17,"Score 3The Utility’s senior managementmainly focuses on ensuring the organisation and staff comply with laws and regulations.The senior management communicates to staff about compliance on an ad hoc basis, e.g., when significant issues emerge.There is no evidence of communication on the organisation’s integrity standards with external stakeholders.",Score 4Between 3 and 5,"Score 3The Utility conducts integrity risk assessments to comply with regulations, as requested by relevant authorities such as the national anti-corruption agency, sector regulator, ministries, or similar. The assessment scope is exclusively decided upon by the relevant authority.","Score 5There is a gift policy in place, with clear definitions of the value and type of gift permissible to employees.Conflicts of interest declarations are required from 1) management 2) board members 3) contractors.The Utility maintains a registry of all conflicts of interest declarations.The agenda of the board of director meetings includes a standing item on conflicts of interest declarations, to enable attendees to identify any conflicts of interest relating to the agenda items.",,,,,,,,,,,,NA,NA,UNKNOWN
online,206,,2,08/09/2025 15:14,08/09/2025 15:15,Score 4Between 3 and 5,Score 4Between 3 and 5,Score 4Between 3 and 5,,,,,,,,,,,,,NA,NA,UNKNOWN
